{
  "$schema": "http://json-schema.org/draft-07/schema#",
  "$id": "plugin.schema.json",
  "type": "object",
  "required": ["name", "version", "description", "license"],
  "additionalProperties": true,
  "properties": {
    "name": { "type": "string", "pattern": "^[a-z0-9-]+$" },
    "version": { "type": "string", "pattern": "^\\d+\\.\\d+\\.\\d+$" },
    "description": { "type": "string", "minLength": 10 },
    "license": { "type": "string" },
    "author": { "type": "string" },
    "commands": { "type": "array", "items": { "type": "string" } },
    "agents": { "type": "array", "items": { "type": "string" } },
    "hooks": { "type": "string" },
    "mcpServers": { "type": "string" }
  }
}
